[
 {
  "id": "staying-safe-at-home",
  "title": "Staying safely at home",
  "order": 10,
  "headline": "Make the home safer",
  "when": {
   "any": [
    {
     "field": "homeSafety.concerns",
     "op": "truthy"
    },
    {
     "field": "homeSafety.smokeAlarms",
     "op": "falsy"
    },
    {
     "field": "cognition.wandering",
     "op": "truthy"
    },
    {
     "all": [
      {
       "field": "living.situation",
       "op": "eq",
       "value": "alone"
      },
      {
       "field": "person.age",
       "op": "gte",
       "value": 80
      }
     ]
    }
   ]
  },
  "priority": {
   "default": "soon",
   "rules": [
    {
     "when": {
      "field": "homeSafety.smokeAlarms",
      "op": "falsy"
     },
     "level": "now"
    },
    {
     "when": {
      "field": "cognition.wandering",
      "op": "truthy"
     },
     "level": "now"
    }
   ]
  },
  "noticed": [
   {
    "when": {
     "field": "living.situation",
     "op": "eq",
     "value": "alone"
    },
    "text": "{{name}} lives alone, so there may be no one nearby if something goes wrong."
   },
   {
    "when": {
     "field": "homeSafety.concerns",
     "op": "truthy"
    },
    "text": "You mentioned: {{homeConcerns}}."
   },
   {
    "when": {
     "field": "homeSafety.smokeAlarms",
     "op": "falsy"
    },
    "text": "The home may not have working smoke alarms."
   },
   {
    "when": {
     "field": "homeSafety.personalAlarm",
     "op": "falsy"
    },
    "text": "{{name}} does not have a personal alarm to call for help."
   },
   {
    "when": {
     "field": "cognition.wandering",
     "op": "truthy"
    },
    "text": "There have been times when {{name}} has left home and become lost or confused."
   }
  ],
  "whyItMatters": "Small changes at home, such as working alarms, good lighting and a way to call for help, prevent many emergencies and make it more likely someone can keep living at home.",
  "whoCanHelp": [
   "Family and neighbours",
   "GP or practice nurse",
   "Occupational therapist",
   "Fire and Emergency New Zealand"
  ],
  "questions": [
   {
    "for": "GP",
    "question": "Would {{name}} qualify for a funded personal alarm, and how do we arrange it?"
   },
   {
    "for": "Occupational therapist",
    "question": "Which changes in the home would make the biggest difference to safety?"
   }
  ],
  "information": [
   {
    "when": {
     "field": "homeSafety.smokeAlarms",
     "op": "falsy"
    },
    "title": "Smoke alarms",
    "body": "Fire and Emergency New Zealand recommends long-life photoelectric smoke alarms in every bedroom, living area and hallway, and offers home fire safety advice.",
    "sourceId": "fenz-smoke-alarms"
   }
  ],
  "actions": [
   {
    "id": "smoke-alarms",
    "when": {
     "field": "homeSafety.smokeAlarms",
     "op": "falsy"
    },
    "title": "Fit working smoke alarms",
    "description": "Install long-life photoelectric alarms in bedrooms, living areas and hallways, and test them.",
    "timing": "This week",
    "responsible": "Family",
    "priority": "now"
   },
   {
    "id": "personal-alarm",
    "when": {
     "all": [
      {
       "field": "homeSafety.personalAlarm",
       "op": "falsy"
      },
      {
       "field": "living.situation",
       "op": "in",
       "value": [
        "alone",
        "with_partner"
       ]
      }
     ]
    },
    "title": "Arrange a personal alarm",
    "description": "Ask the GP whether a funded personal alarm is available, or compare private monitored alarms.",
    "timing": "Within 2 weeks",
    "responsible": "Family with the GP"
   },
   {
    "id": "wandering-plan",
    "when": {
     "field": "cognition.wandering",
     "op": "truthy"
    },
    "title": "Agree a plan for when {{name}} goes missing",
    "description": "Keep a recent photo and description ready, consider a location device, and tell close neighbours.",
    "timing": "This week",
    "responsible": "Family",
    "priority": "now"
   },
   {
    "id": "home-walkthrough",
    "title": "Walk through the home for hazards",
    "description": "Check lighting, loose mats, clutter on floors, and how easy it is to get in and out of the shower and bed.",
    "timing": "Within a month",
    "responsible": "Family"
   }
  ],
  "providerTypes": []
 },
 {
  "id": "home-care-and-support",
  "title": "Home care and support",
  "order": 20,
  "headline": "Get the right help at home",
  "when": {
   "any": [
    {
     "field": "support.familySupport",
     "op": "in",
     "value": [
      "none",
      "limited"
     ]
    },
    {
     "field": "mobility.level",
     "op": "in",
     "value": [
      "needs_help",
      "wheelchair"
     ]
    },
    {
     "field": "health.medications",
     "op": "eq",
     "value": "needs_help"
    },
    {
     "field": "hospital.status",
     "op": "neq",
     "value": "none"
    }
   ]
  },
  "priority": {
   "default": "soon",
   "rules": [
    {
     "when": {
      "all": [
       {
        "field": "mobility.level",
        "op": "in",
        "value": [
         "needs_help",
         "wheelchair"
        ]
       },
       {
        "field": "living.situation",
        "op": "eq",
        "value": "alone"
       }
      ]
     },
     "level": "now"
    },
    {
     "when": {
      "field": "hospital.status",
      "op": "eq",
      "value": "in_hospital"
     },
     "level": "now"
    }
   ]
  },
  "noticed": [
   {
    "text": "{{name}} currently has {{supportSummary}}."
   },
   {
    "when": {
     "field": "mobility.level",
     "op": "in",
     "value": [
      "needs_help",
      "wheelchair"
     ]
    },
    "text": "{{name}} needs help with moving around, which makes personal care and daily tasks harder."
   },
   {
    "when": {
     "field": "health.medications",
     "op": "eq",
     "value": "needs_help"
    },
    "text": "Taking medicines correctly has become difficult without help."
   }
  ],
  "whyItMatters": "The right mix of help, from a few hours of household support to daily personal care, is often what makes staying at home possible and safe.",
  "whoCanHelp": [
   "Needs Assessment and Service Coordination (NASC)",
   "GP",
   "Home support providers",
   "Pharmacist"
  ],
  "questions": [
   {
    "for": "NASC",
    "question": "What funded home support could {{name}} be eligible for, and how long is the wait?"
   },
   {
    "for": "Pharmacist",
    "question": "Could medicines be supplied in blister packs, and can the pharmacy review them?"
   }
  ],
  "information": [
   {
    "title": "Funded support starts with an assessment",
    "body": "Health New Zealand funds home support for eligible older people after a needs assessment by the local NASC service. A GP can make the referral.",
    "sourceId": "healthify-ageing"
   }
  ],
  "actions": [
   {
    "id": "list-daily-tasks",
    "title": "List the daily tasks that need help",
    "description": "Note what is hard each day (showering, meals, shopping, medicines) so support can be matched to real needs.",
    "timing": "This week",
    "responsible": "{{preparedFor}}"
   },
   {
    "id": "medication-packs",
    "when": {
     "field": "health.medications",
     "op": "in",
     "value": [
      "needs_help",
      "family"
     ]
    },
    "title": "Ask the pharmacy about blister packs",
    "description": "Pre-packed medicines by day and time reduce missed or doubled doses.",
    "timing": "Within 2 weeks",
    "responsible": "Family with the pharmacist"
   },
   {
    "id": "compare-private-support",
    "when": {
     "field": "funding.budgetConcern",
     "op": "neq",
     "value": "significant"
    },
    "title": "Compare private home support while waiting",
    "description": "If funded help will take time, a few privately paid hours can bridge the gap.",
    "timing": "Within a month",
    "responsible": "Family"
   }
  ],
  "providerTypes": [
   "home_care"
  ]
 },
 {
  "id": "falls-and-mobility",
  "title": "Falls and mobility",
  "order": 30,
  "headline": "Reduce the risk of another fall",
  "when": {
   "any": [
    {
     "field": "mobility.fallsLast12Months",
     "op": "gte",
     "value": 1
    },
    {
     "field": "mobility.fearOfFalling",
     "op": "truthy"
    },
    {
     "field": "mobility.level",
     "op": "in",
     "value": [
      "uses_aid",
      "needs_help",
      "wheelchair"
     ]
    }
   ]
  },
  "priority": {
   "default": "soon",
   "rules": [
    {
     "when": {
      "all": [
       {
        "field": "future.preference",
        "op": "eq",
        "value": "residential_care"
       },
       {
        "field": "future.timeframe",
        "op": "eq",
        "value": "now"
       }
      ]
     },
     "level": "soon"
    },
    {
     "when": {
      "field": "mobility.fallsLast12Months",
      "op": "gte",
      "value": 2
     },
     "level": "now"
    }
   ]
  },
  "noticed": [
   {
    "when": {
     "field": "mobility.fallsLast12Months",
     "op": "gte",
     "value": 1
    },
    "text": "{{name}} has had {{falls}} in the last 12 months."
   },
   {
    "when": {
     "field": "mobility.fearOfFalling",
     "op": "truthy"
    },
    "text": "{{name}} is worried about falling, which can lead to moving less and becoming weaker."
   },
   {
    "when": {
     "field": "mobility.level",
     "op": "eq",
     "value": "uses_aid"
    },
    "text": "{{name}} uses a walking aid."
   }
  ],
  "whyItMatters": "One fall makes another more likely. Many falls can be prevented with a medication review, strength and balance exercise, and a safer home.",
  "whoCanHelp": [
   "GP",
   "Physiotherapist",
   "Occupational therapist",
   "Live Stronger for Longer classes"
  ],
  "questions": [
   {
    "for": "GP",
    "question": "Could any of {{name}}'s medicines be adding to dizziness or falls?"
   },
   {
    "for": "GP",
    "question": "Should eyesight, blood pressure or bone health be checked after these falls?"
   },
   {
    "for": "Physiotherapist",